ISO3,ID,add_or_remove,acaps_category,acaps_measure,acaps_comments,source,start_date,end_date,affected_pcodes,compliance_level,can_be_modelled,final_input,npis_linked,OCHA_comments
SSD,330.0,add,Movement restrictions,International flights suspension,Flights suspended with affected countries. ||targeted pop group: Yes|non compliance: Not applicable,AA|source type: Media|link: https://www.aa.com.tr/en/africa/s-sudan-halts-flights-with-covid-19-affected-countries/1765141|,1584057600000000000,,,,,,,
SSD,343.0,add,Public health measures,Health screenings in airports and border crossings,||targeted pop group: No|non compliance: Not applicable,Eye Radio|source type: Media|link: https://eyeradio.org/some-vips-avoid-coronavirus-screening-at-jia/|,1582156800000000000,,,,,,,
SSD,349.0,add,Public health measures,Awareness campaigns,Sanitation and hygiene recommendations||targeted pop group: No|non compliance: Not applicable,East African|source type: Media|link: https://www.theeastafrican.co.ke/news/ea/South-Sudan-precautions-against-coronavirus/4552908-5491866-1258q0d/index.html|,1584230400000000000,,,,,,,
SSD,816.0,add,Social distancing,Limit public gatherings,ban of public gatherings||targeted pop group: No|non compliance: Not available,Anadolu|source type: Media|link: https://www.aa.com.tr/en/africa/coronavirus-south-sudan-bans-social-gatherings/1768378|,1584230400000000000,,,,,,,
SSD,817.0,add,Public health measures,Isolation and quarantine policies,"travelers from coronavirus affected countries are required to self-quarantine, including appointed ministers and deputy ministers||targeted pop group: Yes|non compliance: Not applicable",AA|source type: Media|link: https://www.aa.com.tr/en/africa/coronavirus-south-sudan-bans-social-gatherings/1768378|alternative source: https://sudantribune.com/spip.php?article69109,1584316800000000000,,,,,,,
SSD,1754.0,add,Social distancing,Schools closure ,South Sudan announces suspension of all classes in all schools and universities for the next month.||targeted pop group: No|non compliance: Not applicable,Radio Tamazuj|source type: Media|link: https://radiotamazuj.org/en/news/article/south-sudan-closes-schools-universities-amid-coronavirus-fears|,1584662400000000000,,,,,,,
SSD,2990.0,add,Social distancing,Limit public gatherings,South sudan suspends training of its military.||targeted pop group: Yes|non compliance: Not applicable,AA News|source type: Media|link: https://www.aa.com.tr/en/africa/covid-19-s-sudan-suspends-training-of-unified-forces/1782177|,1585267200000000000,,,,,,,
SSD,5413.0,add,Movement restrictions,Curfews,South sudan has curfew from 8pm to 6am.||targeted pop group: No|non compliance: Arrest/Detention,OSAC|source type: Government|link: https://www.osac.gov/Content/Report/10c44b03-fdf8-4249-856a-1848aca55939|,1585094400000000000,,,,,,,
SSD,5414.0,add,Social distancing,Limit public gatherings,"Governmnet directs postponement of weddings, festivals and other religious and sporting events. ||targeted pop group: Yes|non compliance: Arrest/Detention",South Sudan Governmnet|source type: Social media|link: https://twitter.com/SouthSudanGov/status/1246764630044815360/photo/1|,1586044800000000000,,,,,,,
SSD,5415.0,add,Movement restrictions,Domestic travel restrictions,Suspension of all internal flights||targeted pop group: No|non compliance: Arrest/Detention,South Sudan Governmnet|source type: Social media|link: https://twitter.com/SouthSudanGov/status/1249717234739675143/photo/2|,1586044800000000000,,,,,,,
SSD,5416.0,add,Movement restrictions,Domestic travel restrictions,"Suspension of passenger public transport, both public and private, between states. ||targeted pop group: No|non compliance: Arrest/Detention",South Sudan Governmnet|source type: Social media|link: https://twitter.com/SouthSudanGov/status/1249717234739675143/photo/2|,1586044800000000000,,,,,,,
SSD,5417.0,add,Social distancing,Limit public gatherings,Government directs that funeral gatherings be less than 5 people. ||targeted pop group: No|non compliance: Arrest/Detention,South Sudan Governmnet|source type: Social media|link: https://twitter.com/SouthSudanGov/status/1246764630044815360/photo/1|,1586044800000000000,,,,,,,
SSD,6609.0,add,Social distancing,Changes in prison-related policies,"A circular has been distributed to all states instructing prison authorities to release 1,400 inmates to ease overcrowding.||targeted pop group: Yes|non compliance: Not applicable",The Observer|source type: Media|link: https://observer.ug/news/headlines/64360-south-sudan-frees-1-400-prisoners-over-covid-19|,1587254400000000000,,,,,,,
SSD,7867.0,add,Social distancing,Changes in prison-related policies,"Judiciary of South Suda, Ministry of Interior, justice and constitutional affairs and of the defence and veterans affairs, ordered to report to taskforce on conditions of inmates and to make recommnedations on decongestion of prisons and detention centres.||targeted pop group: Yes|non compliance: Not applicable",South Sudan Government|source type: Social media|link: https://twitter.com/SouthSudanGov/status/1253925919397462016/photo/2|,1587686400000000000,,,,,,,
SSD,8595.0,add,Movement restrictions,Curfews,South Sudan government imposes curfew from 7pm to 6am until further notice.||targeted pop group: No|non compliance: Not available,South Sudan Government|source type: Social media|link: https://twitter.com/SouthSudanGov/status/1255190594600800258/photo/2|,1588118400000000000,,,,,,,
SSD,8596.0,add,Social distancing,Closure of businesses and public services,All tea and shisha stalls are to be closed with immediate effect. ||targeted pop group: No|non compliance: Not available,South Sudan Government|source type: Social media|link: https://twitter.com/SouthSudanGov/status/1255190594600800258/photo/1|,1588032000000000000,,,,,,,
SSD,8597.0,add,Social distancing,Limit public gatherings,"There is a ban on all passenger bodabodas, bodabodas shall be limited to transport of cargo. Bodabodas carrying passengers will be impounded by the police. ||targeted pop group: No|non compliance: Other (add in comments)",South Sudan Government|source type: Social media|link: https://twitter.com/SouthSudanGov/status/1255190594600800258/photo/1|,1588032000000000000,,,,,,,
SSD,8598.0,add,Social distancing,Limit public gatherings,Only one passenger is allowed on a raksha at one time||targeted pop group: No|non compliance: Not available,South Sudan Government|source type: Social media|link: https://twitter.com/SouthSudanGov/status/1255190594600800258/photo/1|,1588032000000000000,,,,,,,
SSD,8599.0,add,Social distancing,Limit public gatherings,"Noaha taxis, mutatus and buses shall operate at half of their capacity only.||targeted pop group: No|non compliance: Not available",South Sudan Government|source type: Social media|link: https://twitter.com/SouthSudanGov/status/1255190594600800258/photo/1|,1588032000000000000,,,,,,,
SSD,8600.0,add,Social distancing,Closure of businesses and public services,Closure of all bars. ||targeted pop group: No|non compliance: Not available,South Sudan Government|source type: Social media|link: https://twitter.com/SouthSudanGov/status/1255190594600800258/photo/1|,1588032000000000000,,,,,,,
SSD,8601.0,add,Social distancing,Limit public gatherings,Restaurants may only provide take away. Violators will be prosecuted. ||targeted pop group: No|non compliance: Up to detention,South Sudan Government|source type: Social media|link: https://twitter.com/SouthSudanGov/status/1255190594600800258/photo/1|,1588032000000000000,,,,,,,
SSD,9634.0,remove,Social distancing,Limit public gatherings,"Agro dealers and hardware stores are granted permission to open for business between 8am and 1pm to supply seeds, tools and parts for cultivation.||targeted pop group: Yes|non compliance: Not applicable",South Sudan Government|source type: Social media|link: https://twitter.com/SouthSudanGov/status/1257169750876139520?s=20|,1588464000000000000,,,,,,,
SSD,9635.0,remove,Movement restrictions,Domestic travel restrictions,Permission is granted for farmers with land within 15km radius of the suburbs of Juba city to attend to farms during day without restrictions so long as they return home before curfew.||targeted pop group: Yes|non compliance: Not applicable,South Sudan Government|source type: Social media|link: https://twitter.com/SouthSudanGov/status/1257169750876139520?s=20|,1588464000000000000,,,,,,,
SSD,9637.0,add,Movement restrictions,Curfews,The curfew time will be altered to allow more freedom: It will now be from 10pm - 6am (was from 8pm-6am)||targeted pop group: No|non compliance: Not applicable,South Sudan Government|source type: Government|link: https://twitter.com/SouthSudanGov/status/1258431679275978752/photo/2|,1588896000000000000,,,,,,,
SSD,9638.0,remove,Social distancing,Closure of businesses and public services,Restuarants and bars will open during non-curfew hours but must abide by strict social distancing rules||targeted pop group: No|non compliance: Not applicable,South Sudan Government|source type: Government|link: https://twitter.com/SouthSudanGov/status/1258431679275978752/photo/2|,1588896000000000000,,,,,,,
SSD,9639.0,remove,Social distancing,Closure of businesses and public services,Shops and stores will re-open but under strict social distancing rules and with a maximum of 5 people in store at one time. ||targeted pop group: No|non compliance: Not applicable,South Sudan Government|source type: Government|link: https://twitter.com/SouthSudanGov/status/1258431679275978752/photo/2|,1588896000000000000,,,,,,,
SSD,9640.0,remove,Social distancing,Limit public gatherings,Boda boda and rickshaw drivers may resume business with max one passenger on a boda boda and two passengers on a rickshaw. However both rider and driver must wear masks.||targeted pop group: Yes|non compliance: Not applicable,South Sudan Government|source type: Government|link: https://twitter.com/SouthSudanGov/status/1258431679275978752/photo/2|,1588896000000000000,,,,,,,
SSD,10521.0,add,Movement restrictions,Border closure ,South Sudan has closed all of it's borders to contain the spread of covid-19. ||targeted pop group: No|non compliance: Not available,Radio Tamazuj|source type: Media|link: https://radiotamazuj.org/en/news/article/south-sudan-closes-airports-and-borders-over-coronavirus-fears|alternative source: https://www.gov.uk/foreign-travel-advice/south-sudan/coronavirus,1584921600000000000,,,,,,,
SSD,10701.0,add,Social distancing,Limit public gatherings,Both public and private businesses shall observe a strict 8 hour work day from 9:00-17:00 with  two weeks in two weeks out of 50% of the workforce to ensure social distancing. ||targeted pop group: Yes|non compliance: Not available,South Sudan Government|source type: Social media|link: https://twitter.com/SouthSudanGov/status/1260350047457357824/photo/3|,1589241600000000000,,,,,,,
SSD,10702.0,add,Public health measures,Amendments to funeral and burial regulations,Family members of deceased covid-19 infected persons are advised to conduct burial according to strict protocol guided by health care professionals. They are also informed not to bring remains to ancestral homes for burial in order to protect family members from the disease. ||targeted pop group: No|non compliance: Not applicable,South Sudan Government|source type: Social media|link: https://twitter.com/SouthSudanGov/status/1261163181952696320/photo/2|,1589414400000000000,,,,,,,
SSD,10705.0,remove,Movement restrictions,International flights suspension,"South Sudan’s Civil Aviation Authority reopened airports and the country’s airspace is now open for domestic, regional and international flights. However, travelers are advised to read the strict guidelines which will be given to all our booking centers before booking.||targeted pop group: No|non compliance: Not applicable",Radio Tamazuj|source type: Media|link: https://radiotamazuj.org/en/news/article/south-sudan-reopens-airports-amid-rise-in-covid-19-cases|,1589241600000000000,,,,,,,
SSD,10706.0,remove,Movement restrictions,Domestic travel restrictions,"South Sudan’s Civil Aviation Authority reopened airports and the country’s airspace is now open for domestic, regional and international flights. However, travelers are advised to read the strict guidelines which will be given to all our booking centers before booking.||targeted pop group: No|non compliance: Not applicable",Radio Tamazuj|source type: Media|link: https://radiotamazuj.org/en/news/article/south-sudan-reopens-airports-amid-rise-in-covid-19-cases|,1589241600000000000,,,,,,,
SSD,10707.0,add,Public health measures,Isolation and quarantine policies,"Travellers in South Sudan must observe a verifiable 14 day quarantine in country OR they must provide proof that the are COVID-19 free, valid within 2 weeks of their arrival. ||targeted pop group: No|non compliance: Not available",South Sudan Government|source type: Social media|link: https://twitter.com/SouthSudanGov/status/1260736239038275584/photo/3|,1589328000000000000,,,,,,,
,,,,,,,2020-05-08,,['SS'],50.0,Yes,Yes,10701 - 9640 - 9639 - 9638,
,,,,,,,2020-04-29,,['SS'],50.0,Yes,Yes,8595,
,,,,,,,2020-03-20,,['SS'],100.0,Yes,Yes,1754,
,,,,,,,2020-04-05,43963.0,['SS'],50.0,Yes,Yes,5415 - 10706,
